intro,links
"Prime Minister Narendra Modi is likely to contest from Varanasi in Uttar Pradesh, the parliamentary seat he retained after winning two seats in the 2014 election.",https://www.ndtv.com/india-news/lok-sabha-elections-2019-pm-narendra-modi-likely-to-stick-with-varanasi-say-sources-amid-buzz-about-2006217
"The US, which has launched an all-out diplomatic and economic campaign against the Nicolas Maduro government of Venezuela, has asked India to join the oil boycott, according to Secretary of State Michael Pompeo.",https://www.ndtv.com/india-news/mike-pompeo-asks-india-to-stop-buying-venezuelan-oil-2006209
"The anti-thesis of Gandhian thought is Congress culture, Prime Minister Narendra Modi wrote today in a blog on the anniversary of Mahatma Gandhi's 1930 Dandi March, targeting the opposition party and the Gandhi family on a day the Congress Working Committee meets for a strategy session in his home state Gujarat.",https://www.ndtv.com/india-news/dandi-march-anniversary-gandhi-ji-wanted-congress-disbanded-pm-narendra-modi-blogs-as-cwc-meets-in-g-2006189
"In controversial remarks, West Bengal Chief Minister Mamata Banerjee on Monday appeared to suggest that the long-drawn Lok Sabha election process was intended to facilitate yet another ""strike"" as part of the BJP's ""gameplan to disturb"" her state.",https://www.ndtv.com/india-news/lok-sabha-elections-2019-told-about-another-strike-mamata-banerjee-links-polls-to-bjp-plan-2006180
"Kerala Congress screening committee will finalise the distribution of seats after discussing with the party chief Rahul Gandhi, when he visits the state on Thursday",https://www.ndtv.com/kerala-news/kerala-congress-to-finalise-seats-and-candidates-on-march-15-when-rahul-gandhi-visits-state-2006179
"Two days after the Election Commission announced dates for Lok Sabha elections, the Congress party is all set to kick-start its campaign for the polls as well as conduct a brainstorming session, to give a final shape to the party's election strategy.",https://www.ndtv.com/india-news/lok-sabha-elections-2019-congress-working-committee-cwc-meet-in-gujarat-priyanka-gandhi-vadra-to-spe-2006171
"Foreign Minister Sushma Swaraj, who is known for her prompt responses on Twitter to calls for help from Indians abroad, shared what she learnt after taking up the top role in Prime Minister Narendra Modi's cabinet. The minister said she now understands English of all accents and grammar.",https://www.ndtv.com/india-news/sushma-swaraj-says-she-has-learnt-to-follow-english-of-all-accents-grammar-after-becoming-foreign-mi-2006169
"The world's biggest democracy will soon hold what's likely to be one of the world's costliest elections. India's six-week-long vote will span the Himalayan range in the north, the Indian Ocean in the south, the Thar desert in the west and the mangroves of the Sundarbans in the east.",https://www.ndtv.com/india-news/why-indias-election-is-among-the-worlds-most-expensive-2006166
"The Congress party has chosen Prime Minister Narendra Modi's home turf Gujarat for its high profile strategy meeting today. The Congress Working Committee (CWC) is all set to kick-start its campaign for the Lok Sabha elections as well as have a brainstorming session, to give a final shape to the party's election strategy. Priyanka Gandhi Vadra will address the CWC for the first time.",https://www.ndtv.com/india-news/congress-working-committee-meeting-in-narendra-modis-home-turf-gujarat-today-priyanka-gandhi-vadra-t-2006152
"The AIADMK in Tamil Nadu Monday kick-started its candidate selection process for the April 18 Lok Sabha elections in the state, with the interview of ticket aspirants of ten constituencies.",https://www.ndtv.com/india-news/lok-sabha-elections-2019-aiadmk-begins-candidate-selection-process-for-lok-sabha-elections-2006150
The Telugu Desam Party (TDP) on Monday alleged that there was a conspiracy in covering all the Lok Sabha seats in Andhra Pradesh in the first phase.,https://www.ndtv.com/india-news/lok-sabha-elections-2019-chandrababu-naidus-party-accuses-kcr-for-early-polls-in-andhra-says-will-st-2006146
"A day after the Lok Sabha election dates were announced, the Shiv Sena on Monday said that the party got into an alliance in Maharashtra with the BJP as the country needs to be taken in the right direction.",https://www.ndtv.com/india-news/shiv-sena-bjp-alliance-will-take-country-in-right-direction-uddhav-thackeray-2006145
"A major tragedy was averted in Jammu and Kashmir on Monday after a man was caught with two grenades and a detonator at an Army camp in Jammu and Kashmir's Poonch district, police said.",https://www.ndtv.com/india-news/man-caught-with-grenades-detonator-at-army-recruitment-rally-in-jammu-and-kashmirs-poonch-2006132
"The ruling BJD on Monday alleged that the four-phase election schedule for Odisha has been announced to suit the BJP since it faces ""bleak"" electoral prospects in the state.",https://www.ndtv.com/india-news/lok-sabha-elections-2019-bjd-spokesman-questions-four-phase-polls-in-odisha-says-done-to-help-bjp-2006127
"Bangladesh Prime Minister Sheikh Hasina on Monday assured her Indian counterpart Narendra Modi that her government would never allow the country's soil to be used by any terrorist organisation under its ""zero tolerance policy"".",https://www.ndtv.com/india-news/wont-allow-bangladesh-soil-to-be-used-by-terrorists-sheikh-hasina-to-pm-modi-2006122
The Lucknow bench of the Allahabad High Court has granted bail to then station house officer of Unnao's Makhi police station who is facing trial for conspiring to help rape accused BJP MLA Kuldeep Singh Sengar.,https://www.ndtv.com/india-news/bail-granted-to-cop-charged-with-helping-accused-bjp-lawmaker-in-unnao-rape-2006119
"Veteran journalist and lawyer S Balakrishnan has sought a police inquiry into Maharashtra Navnirman Sena (MNS) chief Raj Thackeray's claim of another ""Pulwama-like"" terror attack before the Lok Sabha polls.",https://www.ndtv.com/india-news/journalist-seeks-police-inquiry-on-raj-thackerays-pulwama-like-attack-claim-2006112
"RJD leader Tejashwi Yadav on Monday urged opposition leaders to take a united stand against what he called a ""campaign of distortion"" by pro-BJP news channels, and he was backed by his father Lalu Prasad who gave the call - ""boycott Modi media"".",https://www.ndtv.com/india-news/tejashwi-yadav-appeals-to-opposition-to-boycott-bjp-inspired-tv-debates-2006109
"Russia's arms export to India, the world's second largest importer of major arms, fell by a whopping 42 per cent between 2014-18 and 2009-2013, according to a SIPRI report.",https://www.ndtv.com/india-news/russia-arms-exports-to-india-fell-by-42-between-2014-18-2009-13-report-2006107
"Defence Minister Nirmala Sitharaman on Monday alleged that the UPA denied benefits to the ""martyrs"" of paramilitary forces for years and it was the PM Modi government which ultimately conferred these benefits.",https://www.ndtv.com/india-news/congress-denied-martyr-benefits-bjp-conferred-it-nirmala-sitharaman-2006106
Prime Minister Narendra Modi spoke with the crown prince of Abu Dhabi on Monday and thanked him for inviting India to address the Organisation of Islamic Cooperation.,https://www.ndtv.com/india-news/pm-narendra-modi-speaks-with-abu-dhabi-crown-prince-sheikh-mohammed-bin-zayed-al-nahyan-2006101
"""Do you want Mahatama Gandhi's India - where there is love, harmony - or Godse's India, where these is fear and hatred?"" Congress Chief Rahul Gandhi asked today, a day after the Election Commission announced dates for national elections.",https://www.ndtv.com/india-news/rahul-gandhi-asks-do-you-want-mahatma-gandhis-india-or-godses-india-2006096
"India on Friday conveyed to Saudi Arabia that that an ""immediate, irreversible and verifiable action"" to dismantle terror infrastructure is essential to fight the menace of terrorism.",https://www.ndtv.com/india-news/verifiable-steps-against-terror-infrastructure-essential-india-tells-saudi-arabia-2006094
"India and the US have agreed that Pakistan must take ""concerted action to dismantle terror infrastructure and deny a safe haven to terror groups"", the foreign ministry said today after a meeting between Foreign Secretary Vijay Gokhale and US Secretary of State Mike Pompeo. In Delhi, Prime Minister Narendra Modi today contacted Crown Prince of Abu Dhabi, Sheikh Mohammed bin Zayed Al-Nahyan and also met Saudi foreign minister Adel bin Ahmed Al Jubeir, who is on a visit to India.",https://www.ndtv.com/india-news/india-us-ask-pak-for-concerted-action-to-dismantle-terror-groups-2006093
"In a first in Madhya Pradesh, a transgender has beeen given a government job. Sanjana Singh, 36, has been appointed the personal secretary to the director of the state's Department of Social Justice and Disabled Welfare (DSJDW).",https://www.ndtv.com/india-news/in-a-first-transgender-gets-government-job-in-madhya-pradesh-2006089
"The top leadership of AAP huddled into a meeting at Delhi Chief Minister Arvind Kejriwal's residence to discuss preparations for Lok Sabha polls, on Monday, as a senior party leader claimed chances of party's alliance are now nil.",https://www.ndtv.com/india-news/arvind-kejriwal-meets-aam-aadmi-party-leaders-on-poll-preparations-no-chance-of-alliance-now-aap-law-2006087
Two powerful tribal militant groups in Manipur that have a ceasefire agreement with the centre have written to the BJP and its chief Amit Shah to field a candidate of their choice in the upcoming Lok Sabha elections.,https://www.ndtv.com/india-news/manipur-lok-sabha-elections-2019-militant-groups-write-to-amit-shah-backing-bjp-lok-sabha-contender-2006081
"Security forces have succeeded in eliminating the leadership of terror outfit Jaish-e-Mohammed in Kashmir after the Pulwama terror attack in which 40 CRPF soldiers died, a top Army officer said on Monday.",https://www.ndtv.com/india-news/18-terrorists-killed-in-21-days-jaish-leadership-eliminated-in-j-k-army-2006080
"The Left and the Congress are back at the negotiating table for seat sharing in Bengal after overcoming a major hiccup over two seats and pushing the ruling Trinamool Congress out of a possible equation. The Congress has 'conceded' the two seats to the Left, for which the party has named candidates. The Left will reciprocate by not fielding candidates in four seats Congress had won in 2014.",https://www.ndtv.com/india-news/lok-sabha-elections-2019-row-over-bengals-6-seats-settled-congress-cpm-to-discuss-remaining-36-2006075
Congress in Telangana is likely to finalise its candidates for the coming Lok Sabha polls by March 13.,https://www.ndtv.com/india-news/lok-sabha-elections-2019-congress-likely-to-finalise-candidates-for-telangana-by-march-13-2006073
"The Editors Guild of India said today that the Meghalaya High Court's order in a contempt case against The Shillong Times, including its editor and publisher, is ""intimidatory"" and undermines the freedom of press.",https://www.ndtv.com/india-news/editors-guild-slams-meghalaya-courts-order-against-the-shillong-times-2006066
"Ahead of the national elections, the political discourse over the air strikes at Balakot dropped to a new low as Union Minister Anant Hegde questioned how Rahul Gandhi could ask for proof of surgical strikes. ""They want proof of surgical strikes even when whole world acknowledged it,"" Mr Hegde said, referring to the questions raised by the opposition about the impact of the air strikes.",https://www.ndtv.com/india-news/can-rahul-gandhi-prove-he-is-hindu-anant-hegdes-retort-on-balakot-air-strike-2006063
"Did Rahul Gandhi bestow a mark of respect on one of India's most wanted terrorists? That is the accusation that the BJP made on Monday, attacking the Congress chief for ""loving"" terrorists after Mr Gandhi was heard referring to Jaish-e-Mohammed chief Masood Azhar as ""ji"".",https://www.ndtv.com/india-news/rahul-gandhi-says-masood-azhar-ji-in-speech-bjp-hits-back-with-rahullovesterrorist-campaign-2006061
"In a first for Delhi, the Election Commission is planning to set up booths with only women staffers to send across a message of women's empowerment. At these special booths, the presiding officers, polling officers, micro observers and security personnel will all be women.",https://www.ndtv.com/india-news/for-lok-sabha-elections-2019-all-women-polling-booths-for-delhi-2006059
"Senior Congress leader Digvijaya Singh Monday said Narendra Modi would not become prime minister again as he stands ""exposed"" after failing to fulfill promises during the 2014 Lok Sabha polls.",https://www.ndtv.com/india-news/exposed-narendra-modi-wont-be-prime-minister-again-predicts-digvijaya-singh-2006055
Congress president Rahul Gandhi today handed over a ''chadar'' to be offered at the Ajmer Sharif Dargah on the occasion of Urs of Khwaja Moinuddin Chishti.,https://www.ndtv.com/india-news/rahul-gandhi-hands-over-chadar-to-be-offered-at-ajmer-sharif-dargah-2006052
"A 30-year-old married woman from Rajasthan's Jhalawar district was kidnapped and raped for over 20 days by a family acquaintance from a neighbouring village, police said Monday.",https://www.ndtv.com/india-news/rajasthan-woman-raped-for-over-20-days-was-kidnapped-with-son-police-2006049
"In what can be seen as a setback to the Maharashtra Congress ahead of the national election, which begin April 11, party leader Sujay Vikhe Patil, is likely to join the BJP today.",https://www.ndtv.com/india-news/congress-leader-sujay-vikhe-patil-son-of-maharashtra-opposition-leader-likely-to-join-bjp-tomorrow-2006047
"The Rajasthan High Court Monday issued notices to film stars Saif Ali Khan, Neelam Kothari, Sonali Bendre and Tabbu on an appeal by the state government, challenging their acquittal by a trial court in a case of hunting two black bucks in 1998.",https://www.ndtv.com/india-news/prosecution-challenges-4-actors-acquittal-in-black-buck-poaching-case-2006045
"India and the US on Monday agreed that Pakistan needs to take ""concerted action"" to dismantle terrorist infrastructure as Foreign Secretary Vijay Gokhale called on US Secretary of State Mike Pompeo and discussed major foreign policy and security-related issues after the Pulwama terror attack.",https://www.ndtv.com/india-news/foreign-secretary-mike-pompeo-meet-say-pak-must-dismantle-terror-groups-2006040
Saudi Arabia's state minister for Foreign Affairs Adel al-Jubeir called on Prime Minister Narendra Modi on Monday. He arrived on Monday for a brief visit.,https://www.ndtv.com/india-news/saudi-arabia-foreign-minister-adel-al-jubeir-meets-pm-narendra-modi-in-delhi-days-after-pakistan-vis-2006039
"Assets worth <span class=""rupee"">R<span>s.</span></span> 8.46 crore of Delhi-based lawyer Gautam Khaitan, an accused in the <span class=""rupee"">R<span>s.</span></span> 3,600 crore VVIP choppers scam case, have been attached by the Enforcement Directorate (ED) as part of a second criminal probe against him for allegedly possessing undisclosed foreign accounts, the agency said Monday.",https://www.ndtv.com/india-news/rs-8-4-crore-assets-of-gautam-khaitan-attached-in-vvip-choppers-case-2006037
"Former Karnataka Chief Minister S M Krishna Monday said he believes that Narendra Modi becoming the Prime Minister once again was ""inevitable"".",https://www.ndtv.com/india-news/sm-krishna-narendra-modi-becoming-prime-minister-once-again-inevitable-says-former-karnataka-chief-m-2006036
"Finance Minister Arun Jaitley today called ""Mahagathbandhan"" or grand alliance a self-destructive ""coalition of rivals"" and said the choice before voters in the general elections would be either ""Modi or chaos"".",https://www.ndtv.com/india-news/lok-sabha-elections-2019-either-narendra-modi-or-chaos-arun-jaitley-lists-choice-in-lok-sabha-polls-2006030
"Congress in Telangana on Monday announced it would boycott the MLC election on Tuesday, accusing ruling TRS of poaching four of its lawmakers and a TDP legislator ''in a brazen manner by adopting all illegal means.''",https://www.ndtv.com/india-news/congress-in-telangana-to-boycott-mlc-election-2006028
Uttar Pradesh Cabinet minister and leader of Suheldev Bharatiya Samaj Party (SBSP) Om Prakash Rajbhar has said the BJP will return to power at the Centre under the leadership of Prime Minister Narendra Modi if it takes along all its allies.,https://www.ndtv.com/india-news/uttar-pradesh-cabinet-minister-om-prakash-rajbhar-says-bjp-will-return-to-power-at-centre-if-it-take-2006023
"Computer Baba, the self-styled godman granted the status of minister in the previous BJP government in Madhya Pradesh, has managed a neat survival trick by landing a role in the new Congress administration too. The Baba, born Namdev Tyagi, was appointed chairman of the Ma Narmada, Ma Kshipra evam Ma Mandakini River Trust (the rivers Narmada, Kshipra and Mandakini Trust) today.",https://www.ndtv.com/india-news/namdev-tyagi-computer-baba-minister-in-bjp-rule-scores-plum-job-from-congress-2006022
The Indian Institute of Technology Delhi (IIT Delhi) is working for the central government to devise a plan detailing what action should be taken and at what time for controlling air pollution in the city.,https://www.ndtv.com/india-news/iit-delhi-to-propose-measures-to-control-air-pollution-in-city-to-centre-2006008
"When fugitive diamond merchant Nirav Modi was spotted on the streets of London last week looking somewhat different and wearing an extravagant ostrich-leather jacket, the government insisted there had been no delay on India's part in efforts to prosecute him and extradite him.",https://www.ndtv.com/india-news/why-nirav-modi-wanted-in-india-is-roaming-the-streets-of-london-2006007
"A day after the fatal crash of a Boeing's 737 MAX aircraft in Ethiopia, India's aviation regulator DGCA on Monday issued additional safety instructions for the planes operating in the country after saying it was reviewing safety issues related to the model.",https://www.ndtv.com/india-news/ethiopian-airlines-crash-dgca-to-issue-new-safety-rules-for-boeing-737-max-2005996
"Congress chief Rahul Gandhi today cleared the air after party leader Sheila Dikshit's comment had triggered speculation about a change of heart in the party regarding an alliance with Arvind Kejriwal's Aam Aadmi Party. There will be no alliance and the Congress will go it alone on all seven Lok Sabha seats in Delhi, Mr Gandhi said.",https://www.ndtv.com/india-news/rahul-gandhi-shuts-door-on-aap-says-will-contest-all-7-seats-in-delhi-2005988
"Amid reports that the resolution to declare Pakistan-based JeM chief Masood Azhar as a global terrorist would come up in the UN Security Council on March 13, China on Monday said ""a responsible solution"" can only come through discussions.",https://www.ndtv.com/india-news/china-cryptic-on-jem-masood-azhar-ban-says-trying-to-ease-india-pakistan-tensions-2005983
An investigation has been ordered against a police officer who clicked a selfie with a constable who was removing political posters from an electricity pole in Uttar Pradeshs Unnao. The sub-inspector had asked his subordinate to climb up the pole to remove the posters after the Election Commission imposed the model code of conduct on Sunday.,https://www.ndtv.com/india-news/unnao-uttar-pradesh-police-officer-clicks-selfie-with-constable-on-electric-pole-who-was-removing-po-2005976
"The Enforcement Directorate on Monday it has attached a Paris-based property worth <span class=""rupee"">R<span>s.</span></span> 5.83 crore of the ex-wife of Christian Michel, the alleged middleman arrested in the VVIP choppers scam case, under the anti-money laundering law.",https://www.ndtv.com/india-news/vvip-choppers-case-enforcement-directorate-attaches-christian-michels-ex-wifes-paris-property-worth-2005966
"National Conference chief Farooq Abdullah today joined the political battle over the airstrikes on the Jaish-e Mohammad camp at Balakot, saying the BJP-led government had conducted it with an eye to winning coming national elections. The impact of the February 26 air strikes have become a matter of controversy, with various opposition parties demanding the government reveal the number of terrorists killed and provide evidence.",https://www.ndtv.com/india-news/farooq-abdullahs-spin-to-balakot-air-strike-totally-for-election-2005945
"The Centre has allowed state governments to put to ""public use"" some enemy properties that were left behind by people who migrated to Pakistan since the Partition and to China after the 1962 Sino-Indian war, the officials said on Monday.",https://www.ndtv.com/india-news/properties-of-those-who-migrated-to-pakistan-and-china-to-be-put-to-public-use-2005942
"Using the hot button issue of Kerala's Sabarimala temple to ask for votes will be seen as a violation of the model of conduct enforced ahead of the Lok Sabha elections, the Election Commission said on Monday.",https://www.ndtv.com/india-news/sabarimala-row-election-commission-warns-against-using-issue-for-lok-sabha-elections-2019-2005931
The Reserve Bank of India (RBI) board had warned about the short-term negative effect of demonetization on growth and had noted that it would have no material impact on the campaign against black money.,https://www.ndtv.com/india-news/rbi-had-objections-to-notes-ban-agreed-in-public-interest-reveals-rti-2005906
"A paraglider from the US has been stranded in the hills of Himachal Pradesh's Kangra district since today morning, officials said.",https://www.ndtv.com/india-news/us-paraglider-stranded-in-himachal-pradesh-to-be-rescued-by-helicopter-2005905
"A campaign by a member of the erstwhile royal family of Udaipur has received over 3 lakh items of clothing, creating a Guinness world record for the largest collection of clothes for donation, a press release claimed.",https://www.ndtv.com/india-news/guinness-record-in-udaipur-after-donation-of-over-3-lakh-clothing-items-2005904
Trouble seems to be brewing for the Congress in Gujarat as Jamnagar (Rural) lawmaker Vallabh Dharaviya today became the third MLA to quit the party in the last four days.,https://www.ndtv.com/india-news/gujarat-congress-lawmaker-vallabh-dharaviya-resigns-third-to-quit-party-in-4-days-2005901
A court in Delhi has sought a response from Tihar Jail authorities today on the Enforcement Directorate's plea to interrogate Christian Michel inside the prison. He was arrested by the Enforcement Directorate in the AgustaWestland chopper case in December last year after his extradition from Dubai,https://www.ndtv.com/india-news/court-asks-for-tihar-jails-response-on-plea-to-question-christian-michel-2005871
"The Enforcement Directorate has filed a fresh charge sheet against PNB scam accused Nirav Modi under the anti-money laundering law, officials said Monday.",https://www.ndtv.com/india-news/probe-agency-files-fresh-chargesheet-against-nirav-modi-in-pnb-scam-2005866
"Top leaders of the BJP are holding a series of meetings today to discuss preparations for the national elections which begin on April 11. One of these would be party chief Amit Shah and senior leader Arun Jaitley's meeting with party spokespersons. Besides, a committee led by Union minister Rajnath Singh will also meet to discuss the party's election manifesto, for which the party is crowdsourcing ideas.",https://www.ndtv.com/india-news/lok-sabha-elections-2019-flurry-of-meetings-in-bjp-camp-as-party-fast-tracks-poll-campaign-2005857
Veteran politician Sharad Pawar today said he will not contest the coming Lok Sabha elections. The chief of Nationalist Congress Party was expected to contest from the Madha Lok Sabha seat in southwest Maharashtra. But the 78-year-old former Union minister said he has decided against the idea.,https://www.ndtv.com/india-news/sharad-pawar-former-union-minister-and-ncp-chief-will-not-contest-national-elections-2005856
Schools in Kashmir opened today after remaining closed for more than three months for winter vacations.,https://www.ndtv.com/india-news/schools-in-kashmir-open-after-3-month-winter-vacation-2005842
"Akash Ambani and Shloka Mehta, whose wedding in Mumbai was the most-talked-about over the weekend, exchanged vows in a glittering ceremony that looked straight out of a Bollywood set.The 28-year-olds, who studied together at the school run by the Ambani family, promised to respect and cherish each other.",https://www.ndtv.com/india-news/akash-ambani-shloka-mehta-wedding-akash-ambani-shloka-mehta-exchange-vows-in-sickness-and-health-2005840
Congress president Rahul Gandhi today expressed his deepest condolences to the families of those killed in the Ethiopian Airlines plane crash.,https://www.ndtv.com/india-news/rahul-gandhi-condoles-death-of-157-people-in-ethiopian-airline-plane-crash-2005839
"As a leader of Mamata Banerjee's Trinamool Congress voices concern about elections in the month of Ramzan and the impact on Muslim votes, Hyderabad parliamentarian Asaduddin Owaisi rubbished such talk. The national election will be held from April 11 to May 19 and the results will be declared on May 23, the Election Commission said yesterday.",https://www.ndtv.com/india-news/lok-sabha-elections-2019-aimims-asaduddin-owaisi-rejects-concerns-says-ramzan-will-lead-to-more-voti-2005810
"Detergent brand Surf Excel, known for its heart-warming ads, was caught in a Twitter flap over its latest campaign, revolving around the Holi festival and Hindu-Muslim friendship.",https://www.ndtv.com/india-news/row-over-new-surf-excel-holi-ad-on-twitter-praise-amid-calls-for-boycott-2005794
"Former foreign secretary S Jaishankar, Akali Dal leader Sukhdev Singh Dhindsa, film personalities Mohanlal and Prabhu Deva are among the 47 prominent personalities who were conferred Padma awards by President Ram Nath Kovind today.",https://www.ndtv.com/india-news/former-diplomat-jaishankar-akali-dal-leader-mohanlal-among-47-recipients-of-padma-awards-2005793
