intro,links
"Union Minister Nitin Gadkari today said neither does he have any aspirationsnor the Rashtriya Swayamsevak Sangh(RSS), the BJP's ideological mentor, any plans to project him as a prime ministerial candidate for the national election. The remarks come amid speculation that he would be projected as the next prime minister of the country if his party needed support of other political parties to form a government after the election.",https://www.ndtv.com/india-news/nitin-gadkari-says-neither-do-i-have-aspirations-nor-rss-any-designs-to-make-me-pm-candidate-2005451
"The SP-BSP-RLD alliance in Uttar Pradesh had no accommodation problems and is battle-ready to take on the BJP in the Lok Sabha polls, RLD vice president Jayant Chaudhary said Sunday, asserting the tie-up was made on workers'' feedback and not through a ""top-down process"".",https://www.ndtv.com/india-news/ready-to-take-on-bjp-says-jayant-chaudhary-2005448
"Uttar Pradesh will vote in all seven phases from April 11 to May 19 in the national election. With the maximum number of seats, the politically vital state is set to host the most-watched election battle that will test an opposition alliance of bitter rivals Mayawati and Akhilesh Yadav, joining hands to take on the BJP, which scooped a colossal 73 seats in the 2014 election.",https://www.ndtv.com/india-news/lok-sabha-election-a-litmus-test-for-mayawati-akhilesh-yadav-alliance-2005447
"Amidst the row over allegations of EVMs not being tamper-proof, Nationalist Congress Party (NCP) chief Sharad Pawar has asked his party's booth-level workers to stay alert at the time of demonstration of voting machines on the polling day.",https://www.ndtv.com/india-news/be-alert-during-evm-demo-on-polling-day-sharad-pawar-tells-party-workers-2005445
"Hours before the possible announcement of elections, Odisha Chief Minister Naveen Patnaik announced 33 per cent reservation for women in ticket allocation for the national elections in his party, the Biju Janata Dal. Assembly elections will be held in the state along with the national elections. The dates will be announced this evening.",https://www.ndtv.com/india-news/naveen-patnaik-announces-33-per-cent-reservation-for-women-in-party-tickets-2005439
"As the Election Commission today made it official that the dates for the national election would be announced at 5 pm, concerns were expressed by a few politicians - but entirely of the astrological kind.",https://www.ndtv.com/india-news/lok-sabha-elections-2019-poll-announcement-in-rahu-kaal-worries-politicians-from-south-2005431
"Pakistan on Sunday resorted to unprovoked ceasefire violations targeting forward posts and villages at four places along the Line of Control (LoC) in Jammu and Kashmir's Poonch district, officials said.",https://www.ndtv.com/india-news/pakistan-violates-ceasefire-at-4-places-in-jammu-and-kashmirs-poonch-say-officials-2005429
"Assembly elections in four states - Andhra Pradesh, Sikkim, Arunachal Pradesh and Odisha - are expected to be held along with the Lok Sabha polls this time. The term of the government sin all four states are set to end by April-May.",https://www.ndtv.com/india-news/assembly-elections-2019-for-four-states-assembly-elections-also-likely-with-national-polls-2005424
"An Indian pilot of Air India was handcuffed in front of passengers and deplaned by US law enforcement authorities on allegations related to accessing and downloading child pornography, officials of the national carrier said on Sunday.",https://www.ndtv.com/india-news/air-india-pilot-handcuffed-deported-from-us-over-child-porn-charges-2005423
Huge crowds gathered at the Dalai Lama's temple in Himachal Pradesh's Dharamsala Sunday to commemorate 60 years since the failed Tibetan uprising against Chinese rule that drove the spiritual leader into exile.,https://www.ndtv.com/india-news/tibet-supporters-in-himachals-dharamsala-mark-60-years-since-uprising-2005407
"The dates for national election will be announced by the Election Commission this evening at 5 pm, signaling the start of a gigantic voting exercise that will see Prime Minister Narendra Modi seeking another term in office and the opposition attempting to join forces to put up a strong fight. Elections will also be held in four states -- Andhra Pradesh, Sikkim, Arunachal Pradesh and Odisha - along with the parliamentary polls. The opposition Congress had accused the Election Commission of delaying the dates to enable the government to rush through the launch of welfare schemes and projects; no announcements can be made once the model code of conduct kicks in with the election dates. Commission sources have rubbished the claims.",https://www.ndtv.com/india-news/lok-sabha-elections-2019-dates-for-national-election-and-polls-in-4-states-to-be-announced-at-5-pm-b-2005379
Madhya Pradesh Governor Anandiben Patel has approved an ordinance to increase reservation for Other Backward Classes (OBCs) from 14 per cent to 27 per cent.,https://www.ndtv.com/india-news/lok-sabha-elections-2019-madhya-pradesh-governor-anandiben-patel-approves-ordinance-to-increase-obc-2005373
"Businessman Robert Vadra, who had indicated his keenness to enter active politics, today said he would like to ""serve people on a bigger platform"" only after he is cleared of the charges against him. Mr Vadra, husband of Congress leader Priyanka Gandhi Vadra, shared pictures of posters urging him to contest the upcoming national election.",https://www.ndtv.com/india-news/robert-vadra-drops-fresh-hint-says-would-like-to-serve-people-on-bigger-platform-2005372
"In what could be seen as a jolt to Bihar Congress ahead of the parliamentary election, senior leader and spokesman Binod Sharma resigned on Saturday, contending that the party should not have demanded evidence of Balakot air strike.",https://www.ndtv.com/india-news/congress-leader-vinod-sharma-upset-over-demand-for-proof-of-iaf-strike-quits-party-2005352
"Lok Sabha elections will begin on April 11 and will be held over seven phases followed by counting of votes on May 23, the Election Commission announced today.&nbsp;Chief Election Commissioner Sunil Arora said the model code of conduct would come into immediate effect from Sunday and 10 lakhs polling stations would be set up this time as against about nine lakhs in 2014.",https://www.ndtv.com/india-news/lok-sabha-election-updates-pm-modi-in-gujarat-today-jd-s-congress-to-finalise-seats-in-karnataka-2005348
West Bengal Chief Minister Mamata Banerjee has ordered her top minister and Kolkata Mayor Firhad Hakim to examine disciplinary action against a party legislator for his meeting with BJP leader Mukul Roy on Friday.,https://www.ndtv.com/india-news/lok-sabha-elections-2019-mamata-banerjee-seeks-action-against-mla-for-meeting-with-bjps-mukul-roy-2005342
"With the arrest of 18 people from different parts of the country, Jaipur police on Saturday claimed to have busted an international gang involved in duping people of crores of rupees on the pretext of providing them rare and valuable radioactive articles that could be sold to NASA.",https://www.ndtv.com/india-news/18-arrested-for-duping-people-by-selling-radioactive-articles-in-jaipur-2005336
"In the last month before the Election Commission announces the national election dates, Prime Minister Narendra Modi has made 28 trips across India, launching an unprecedented 157 projects, NDTV has found.",https://www.ndtv.com/india-news/lok-sabha-elections-2019-157-projects-in-30-days-behind-pm-narendra-modis-last-minute-inauguration-b-2005335
"Days after the Congress said it would go it alone in the general elections, Delhi Chief Minister and AAP supremo Arvind Kejriwal Saturday termed the party ""arrogant"" and claimed that its candidates would lose their deposits in the polls.",https://www.ndtv.com/india-news/on-no-alliance-with-aap-arvind-kejriwal-calls-congress-party-arrogant-2005330
BJP chief Amit Shah on Saturday met RSS chief Mohan Bhagwat and attended the meeting of its Akhil Bharatiya Praitinidhi Sabha.,https://www.ndtv.com/india-news/amit-shah-meets-mohan-bhagwat-attends-rss-convention-in-madhya-pradesh-2005325
Saudi Arabia's Minister of State for Foreign Affairs Adel al-Jubeir will visit India on Monday to discuss some important follow-ups from the visit of the Crown Prince Mohammed bin Salman to India last month.,https://www.ndtv.com/india-news/saudi-foreign-minister-adel-al-jubeir-to-visit-india-on-monday-to-follow-up-on-talks-2005322
Spiritual guru Sri Sri Ravi Shankar on Saturday dismissed AIMIM chief Asaduddin Owaisi's comment doubting his suitability as a mediator in the Ayodhya dispute.,https://www.ndtv.com/india-news/sri-sri-dismisses-asaduddin-owaisis-comments-against-him-on-ayodhya-panel-2005319
"Four teenagers escaped from a government boysshelter home in Deoria district on Saturday, the officials said.",https://www.ndtv.com/india-news/four-teens-flee-uttar-pradeshs-gorakhpur-shelter-home-2005317
"A Congress leader in Telangana delivered a hugely controversial statement on Saturday, attacking Prime Minister Narendra Modi in the presence of party chief Rahul Gandhi.",https://www.ndtv.com/india-news/in-rahul-gandhis-presence-congress-leader-vijayashanti-says-pm-modi-like-terrorist-2005310
"Akash Ambani and Shloka Mehta were married in a glittering wedding ceremony in Mumbai on Saturday, surrounded by celebrities from all over the world. Akash Ambani is the oldest son of India's richest man Mukesh Ambani and Shloka Mehta is the daughter of diamantaire Russel Mehta. There was huge interest in the wedding, especially after the dazzling display seen at which Mukesh Ambani's daughter Isha's wedding last year.",https://www.ndtv.com/india-news/akash-ambani-wedding-akash-ambani-shloka-mehtas-dazzling-wedding-see-pictures-2005308
"The central government on Saturday, approved the 40.35 kilometre Surat Metro Rail project with two corridors.",https://www.ndtv.com/india-news/centre-approves-rs-12-020-crore-for-surat-metro-project-2005307
"Congress on Saturday hit out at the government over a media report that PNB scam accused Nirav Modi was living in a swanky apartment in London and alleged that Prime Minister Narendra Modi was running a ""fraudster settlement yojana"" for such fugitives.",https://www.ndtv.com/india-news/pm-narendra-modi-running-fraudster-settlement-scheme-for-nirav-modi-others-congress-2005305
"The 6.6-km Noida City Centre-Noida Electronic City section, an extension of the Delhi Metro's Blue Line in the satellite city was opened for the public on Saturday, hours after it was inaugurated by Prime Minister Narendra Modi.",https://www.ndtv.com/india-news/delhi-metros-ghaziabad-noida-extension-sections-open-for-public-2005304
A Pakistani drone that entered Indian territory through the Rajasthan border was shot down by the army's air defence wing on Saturday evening. It was the second infiltration attempt by an unmanned aerial vehicle (UAV) from the neighbouring country that day.,https://www.ndtv.com/india-news/caught-intruding-drone-shot-down-along-rajasthans-border-with-pakistan-2005303
"A major tragedy was averted Saturday with timely detection of an improvised explosive device (IED) near the Line of Control (LoC) in Akhnoor sector in Jammu, police said.",https://www.ndtv.com/india-news/akhnoor-explosive-device-found-near-line-of-control-in-jammu-tragedy-averted-2005301
"A 60-year-old Pakistani national, who mistakenly ventured into Indian territory, was repatriated as a goodwill gesture, a BSF spokesman said Saturday.",https://www.ndtv.com/india-news/bsf-returns-pakistani-national-60-captured-near-international-border-2005300
"Gujarat chief minister Vijay Rupani Saturday expanded his cabinet by inducting three members, including former Congress lawmaker Jawahar Chavda, who was made a minister a day after he joined the BJP.",https://www.ndtv.com/india-news/gujarat-congress-lawmaker-jawahar-chavda-made-a-minister-hours-after-joining-bjp-2005299
"CBI will extend all necessary help to the United Kingdom authorities for extradition of fugitive billionaire Nirav Modi, wanted in <span class=""rupee"">R<span>s.</span></span> 13,000 crore fraud in Punjab National Bank in collusion with his uncle Mehul Choksi, the agency said Saturday.",https://www.ndtv.com/india-news/will-extend-all-necessary-help-to-uk-for-extradition-of-nirav-modi-cbi-2005295
"Prime Minister Narendra Modi on Saturday told recipients of the Nari Shakti Puraskar, the highest civilian honour for women, that their work is an inspiration for others and exhorted them to go even further in their respective fields.",https://www.ndtv.com/india-news/pm-narendra-modi-meets-nari-shakti-award-winners-says-their-work-an-inspiration-2005294
A Janata Dal (United) Vice-President Prashant Kishor has assured the young people in Bihar that he can help them become members of parliament or members of legislative assemblies.,https://www.ndtv.com/india-news/prashant-kishor-says-if-i-can-help-someone-become-pm-can-help-bihar-youth-too-2005293
"Asserting that the armed forces are ""apolitical and neutral stakeholders in a modern democracy"", the Election Commission today asked political parties across the country to not use photographs of defence personnel on hoardings or posters in the run-up to the Lok Sabha polls.",https://www.ndtv.com/india-news/keep-armed-forces-out-of-political-campaigns-election-body-to-parties-2005292
"Prime Minister Narendra Modi on Saturday said Noida would get an international airport at Jewar, which would be the biggest airport in the country.",https://www.ndtv.com/india-news/prime-minister-narendra-modi-says-jewar-airport-will-be-the-biggest-in-the-country-2005291
"The National Investigation Agency (NIA) has summoned Jammu and Kashmir's separatist Mirwaiz Umar Farooq and son of Hurriyat hardliner Syed Ali Shah Geelani, Naseem Geelani, for questioning in its ongoing probe into the terror funding case.",https://www.ndtv.com/india-news/national-investigation-agency-summons-mirwaiz-umar-farooq-nassem-geelani-for-questioning-2005287
"Maharashtra Navnirman Sena President Raj Thackeray on Saturday claimed another ""Pulwama-like attack would be organised within a couple of months"", close to the Lok Sabha elections.",https://www.ndtv.com/india-news/raj-thackeray-says-another-pulwama-like-attack-likely-before-polls-2005282
"A total of 21 leaders returned to the Congress fold in Nagaland after which the party vowed to put up a united fight against the ""stop-gap"" BJP-NDPP government in the state.",https://www.ndtv.com/india-news/nagaland-congress-solidified-as-21-estranged-leaders-return-2005280
"India exposed Pakistan's ""nuclear bluff"" by carrying out an air strike on a Jaish-e-Mohammed (JeM) terror camp in the neighbouring country's Balakot on February 26, news agency IANS quoted Finance Minister Arun Jaitley as saying on Saturday.",https://www.ndtv.com/india-news/arun-jaitley-says-balakot-air-strike-exposed-pakistans-nuclear-bluff-2005268
"Imagine the website of Donald Trump's Republican Party in the ""maintenance mode"" for over four days after some sort of ""transgression"" or a full-fledged hacking. If that appears impossible, imagine this: The portal of India's ruling Bharatiya Janata Party (BJP) that was allegedly hacked on Tuesday morning was still down today after going into ""maintenance mode"".",https://www.ndtv.com/india-news/bjp-website-down-for-4-days-expert-says-seems-even-the-backup-is-gone-2005265
"Congress president Rahul Gandhi on Saturday said if the Congress ""gets hold"" of diamantaire Nirav Modi, it will give all the money belonging to businessman to the public.",https://www.ndtv.com/india-news/rahul-gandhi-says-will-give-nirav-modis-money-to-poor-if-congress-gets-hold-of-him-2005264
"After a star-studded engagement last year, Akash Ambani and Shloka Mehta are getting married in Mumbai today. The wedding celebrations of Mukesh Ambani and Nita Ambani's son with Shloka Mehta, daughter of diamond magnate Russel Mehta and Mona, will continue on March 10 and 11.",https://www.ndtv.com/india-news/akash-ambani-shloka-mehta-wedding-ambanis-to-celebrate-akash-shloka-wedding-with-aerial-dance-act-an-2005258
"An Indian Air Force MiG-21 Bison, piloted by Wing Commander Abhinandan Varthaman, shot down a Pakistan Air Force F-16 fighter aircraft and there are eyewitness accounts as well as electronic evidence for it, the Ministry of External Affairs said on Saturday.",https://www.ndtv.com/india-news/abhinandan-varthamans-mig-21-bison-shot-down-paks-f-16-have-electronic-evidence-says-foreign-ministr-2005251
"Youngsters queued up in large numbers at Doda stadium in Jammu and Kashmir for Indian Army's recruitment rally today, with many saying they were inspired by Indian Air Force pilot Abhinandan Varthaman's valour.",https://www.ndtv.com/india-news/inspired-by-indian-air-force-pilot-abhinandan-varthaman-youngsters-line-up-to-join-army-2005250
"Delhi Congress Chief Sheila Dikshit met UPA Chairperson Sonia Gandhi in Delhi on Saturday, days after the party ruled out an alliance with the Aam Aadmi Party (AAP) to take on the BJP in the forthcoming Lok Sabha elections.",https://www.ndtv.com/india-news/delhi-congress-chief-sheila-dikshit-meets-sonia-gandhi-days-after-ruling-out-aap-alliance-2005248
"Union Human resource development minister Prakash Javadekar today held the Congress responsible for the alleged financial frauds involving Nirav Modi, Vijay Mallya and Mehul Choksi, adding all such fugitives will be extradited to India by the Narendra Modi-led government.",https://www.ndtv.com/india-news/pm-narendra-modis-government-will-bring-back-all-fugitives-union-minister-prakash-javadekar-2005244
"Hours after Nirav Modi was spotted in London, Congress president Rahul Gandhi on Saturday took to Twitter to list what he claimed were four similarities between the fugitive businessman and the Prime Minister. ""The video of fugitive #NiravModi in London shows an uncanny similarity between him &amp; his bhai (brother), PM Modi. Both have looted India and are called Modi. Both refuse to answer any questions. Both believe they are above the law. Both will face justice,"" Mr Gandhi said in a tweet.",https://www.ndtv.com/india-news/uncanny-similarity-rahul-gandhi-points-at-nirav-modi-clip-to-target-pm-2005240
"Prime Minister Narendra Modi on Saturday laid foundation stones for two thermal power plants, one in Uttar Pradesh and the other in Bihar, while slamming previous governments for ""ignoring"" the power sector.",https://www.ndtv.com/india-news/pm-modi-lays-foundation-stone-for-khurja-and-buxar-thermal-power-plants-2005233
"After a video of Nirav Modi walking down a London street surfaced on the Internet on Saturday, social media users were quick to take a swipe at the fugitive billionaire and soon, the hashtag #NiravInLondon was trending on Twitter.",https://www.ndtv.com/india-news/how-twitter-reacted-to-nirav-modis-rs-9-lakh-ostrich-leather-jacket-2005232
India on Saturday said the Kartarpur corridor talks are related to the emotions of Indian citizens of Sikh faith and it is not in any way a resumption of bilateral dialogue.,https://www.ndtv.com/india-news/kartarpur-talks-nothing-to-do-with-resumption-of-dialogue-centre-2005221
Special teams have been formed to arrest eight policemen who fled after their alleged involvement in the custodial death of two people at Dumra police station in Bihar's Sitamarhi came to light earlier this week.,https://www.ndtv.com/india-news/hunt-on-for-absconding-cops-over-custodial-deaths-in-bihars-sitamarhi-2005220
"Congress' maverick OBC lawmaker Alpesh Thakor, who had been keeping the party on tenterhooks amid speculation that he was headed for the ruling BJP, cleared the air on Saturday saying that his concerns had been settled for now.",https://www.ndtv.com/india-news/alpesh-thakor-dispels-speculations-says-with-the-congress-only-2005211
"India will construct a ""state-of-the-art"" passenger terminal building for the Kartarpur corridor at a cost of <span class=""rupee"">R<span>s.</span></span> 190 crore, officials said Saturday.",https://www.ndtv.com/india-news/india-to-construct-passenger-terminal-building-at-kartarpur-corridor-2005206
A slew of dignitaries and international guests have started arriving at the wedding ceremony of Akash Ambani and Shloka Mehta that is taking place at a hotel in Mumbai.,https://www.ndtv.com/india-news/akash-ambani-shloka-mehta-wedding-sundar-pichai-tony-blair-ban-ki-moon-among-guests-2005197
"The Meghalaya high court, in an order on Friday, held the editor of the newspaper - The Shillong Times - Patricia Mukhim and its publisher, Shobha Chaudhuri, guilty of contempt of court.",https://www.ndtv.com/india-news/meghalaya-high-court-asks-the-shillong-times-editor-patricia-mukhim-to-pay-2-lakh-as-fine-2005194
"It was a starry night in Mumbai with yet another big fat Indian wedding. Akash Ambani and Shloka Mehta married at a hotel in Mumbai. The dinner was hosted at the Jio World Centre in Bandra Kurla Complex. Akash is the son of Reliance Industries Chairman and Managing Director Mukesh Ambani and Nita Ambani, while Shloka is the daughter of diamond magnate Russel Mehta and Mona.",https://www.ndtv.com/india-news/akash-ambani-and-shloka-mehtas-wedding-live-updates-2005187
