intro,links
The Army and the Indian Air Force (IAF) are today expected to brief the press for the first time amid tension between India and Pakistan.,https://www.ndtv.com/india-news/iaf-strikes-in-balakot-pakistan-iaf-army-navy-joint-media-address-1st-after-india-pak-escalation-2000629
"During the proceedings, the Pakistani woman submitted that she has a valid visa till 2020 to stay in India.",https://www.ndtv.com/india-news/delhi-high-court-refuses-relief-to-pak-woman-gives-her-2-weeks-to-leave-india-2000619
"At least 40 school students were injured after two buses collided on the Sonauli-Gorakhpur highway in Purenderpur area of UP's Maharajganj district on Thursday morning, police said.",https://www.ndtv.com/india-news/40-school-students-injured-in-collision-of-2-buses-in-up-2000616
"Prime Minister Narendra Modi's interaction with BJP workers and volunteers was a ""betrayal of national sentiments"", Bahujan Samaj Party chief Mayawati said today as she joined Congress and Aam Aadmi Party (AAP) in criticising the ""Mera Booth, Sabse Mazboot""event through which the prime minister interacted with over 1 crore BJP workers from 15,000 locations across the country. The mega video conference was held amid heightened tension between India and Pakistan.",https://www.ndtv.com/india-news/lok-sabha-elections-2019-mayawati-slams-pm-modi-for-poll-event-says-india-facing-hostility-of-war-2000600
Delhi court has directed Agustawestland case accused Rajeev Saxena to record his statement before a magistrate court.,https://www.ndtv.com/india-news/agustawestland-case-accused-rajeev-saxena-says-i-am-not-under-any-pressure-2000597
Samajwadi Party President Akhilesh Yadav on Thursday lashed out at the BJP for going ahead with Prime Minister Narendra Modi's address to party workers through a mega video-conference amid escalating tension with Pakistan.,https://www.ndtv.com/india-news/iaf-strike-in-balakot-pakistan-akhilesh-yadav-on-pm-narendra-modi-video-conference-2000581
"US President Donald Trump said he and North Korea's Kim have a good relationship, speaking after their summit ended suddenly with no deal on Thursday.",https://www.ndtv.com/india-news/donald-trump-on-north-koreas-kim-we-just-like-each-other-2000577
"US President Donald Trump today said ""we have some reasonably decent news from India and Pakistan"", indicating a resolution amid tension between the two countries over the past few days.",https://www.ndtv.com/india-news/donald-trump-says-we-have-some-reasonably-decent-news-from-india-and-pakistan-report-2000565
"Prime Minister Narendra Modi ignored opposition attacks to address millions of workers of his BJP today amid India-Pakistan tension, and said: ""India will fight as one, India will win as one."" The Prime Minister's mega event, pitched as the ""world'slargest video conference""has been roundly criticized by opposition parties in the backdrop of the worst escalation between India and Pakistan in decades.",https://www.ndtv.com/india-news/mera-booth-sabse-mazboot-pm-narendra-modi-says-india-will-fight-as-one-india-will-win-as-one-2000563
"According to an official, the parade of 500 buses would be the longest anywhere in the world ad will make new Guinness World Record.",https://www.ndtv.com/india-news/prayagraj-at-kumbh-mela-uttar-pradesh-eyes-guinness-record-for-longest-fleet-of-buses-2000559
"IAF Strike In Pakistan: Union Minister VK Singh today put out a sharp and public rebuke for his own party colleague, Karnataka BJP chief BS Yeddyurappa, who has been widely condemned for saying that India's air strikes on a terror camp in Pakistan on Tuesday will help the ruling party win many more seats in the national election due by May.",https://www.ndtv.com/india-news/lok-sabha-elections-2019-on-bs-yeddyurappas-22-lok-sabha-seats-remark-vk-singh-replies-2000550
"Authorities in Islamabad have indefinitely suspended the Samjhauta Express, a decades-old train service between India and Pakistan. A statement by Pakistan's foreign office said that the train service with India has been suspended ""till further notice"". The move by Islamabad comes amid heightened tension between India and Pakistan in the aftermath of the Pulwama terror attack.",https://www.ndtv.com/india-news/samjhauta-express-suspended-indefinitely-by-pakistan-reports-2000517
"Theme of National Science Day 2019 is ""Science for people and people for science.""
The day marks important discovery made by scientist CV Raman - the Raman Effect.",https://www.ndtv.com/india-news/national-science-day-cv-raman-discovered-raman-effect-on-this-day-2000481
"Union Minister Arun Jaitley said on Wednesday that opposition parties ""should introspect"" on their statement criticising the government as it ""is being used by Pakistan"" to bolster their case. He spoke hours after 21 parties met and put out a statement condemning ""blatant politicisation of the sacrifices of the armed forces"" by the ruling party (BJP).",https://www.ndtv.com/india-news/arun-jaitley-tells-opposition-please-introspect-you-first-says-congress-2000478
"The publisher of the Congress-linked National Herald newspaper must vacate its office in the capital, the Delhi High Court said today, cancelling a petition by the publisher against a December order to vacate.",https://www.ndtv.com/india-news/national-herald-newspaper-publisher-ordered-to-vacate-delhi-building-high-court-rejects-its-appeal-2000477
Pakistan violated ceasefire for the second time on Thursday andresorted to unprovoked firing and heavy shelling of mortars along the Line of Control in Krishna Ghati sector.This is the seventh consecutive day that Pakistan has violated the ceasefire by targeting forward posts along the LoC.,https://www.ndtv.com/india-news/pak-violates-ceasefire-in-jammu-and-kashmir-schools-along-loc-closed-2000460
"Pakistan's ambassador to Washington today said that the United States has not condemned India's air strikes on a Jaish-e-Mohammed terror camp on Tuesday, saying the stance ""emboldened"" New Delhi. The complaint comes amid the worst escalation between India and Pakistan in decades and a day after an Indian Air Force pilot was captured by Pakistan after an air combat.",https://www.ndtv.com/india-news/pakistan-ambassador-to-us-asad-majeed-khan-says-us-stand-seen-as-endorsement-of-india-emboldened-the-2000451
"As part of the 'Mera Booth Sabse Mazboot' programme, Prime Minister Narendra Modi interacts with 1 crore Bharatiya Janata Party (BJP) workers and volunteers from 15,000 locations across the country.&nbsp;",https://www.ndtv.com/india-news/prime-minister-narendra-modi-to-address-1-crore-bjp-workers-through-video-conference-today-2000439
"Karnataka BJP chief BS Yeddyurappa today said he was quoted ""out of context"" amid criticism over his comment that that India's air strike on a terror camp in Pakistan on Tuesday has created a wave in favour of Prime Minister Narendra Modi and will help the party win over 22 of 28 seats in the state in the national election due by May.",https://www.ndtv.com/india-news/bs-yeddyurappa-says-air-strikes-will-help-bjp-win-more-than-22-lok-sabha-seats-in-karnataka-2000419
"Railway Minister Piyush Goyal on Wednesday announced a new railway zone for Andhra Pradesh, days after a delegation of BJP lawmakers from the state met the minister demanding the same.",https://www.ndtv.com/india-news/andhra-pradesh-to-get-new-railway-zone-18th-in-india-rail-minister-piyush-goyal-2000413
The Karachi Bakery manager in Bengaluru outlet has claimed that he recieved a call to 'blast the store' if the word 'Karachi' not removed from the name board.,https://www.ndtv.com/bangalore-news/karachi-bakery-in-bengaluru-gets-call-threatening-to-blow-it-up-over-name-2000409
"Prime Minister Narendra Modi will interact with over 1 crore BJP workers and volunteers from 15,000 locations across the country today in what the party claims will be the ""world's largest video conference"".",https://www.ndtv.com/india-news/mera-booth-sabse-mazboot-pm-narendra-modis-worlds-largest-video-conference-with-bjp-booth-workers-op-2000408
"Former Union minister Yashwant Sinha Wednesday lamented at the decimation of Constitutional institutions like the Supreme Court, national investigative agency CBI, RBI, and Election Commission among others under the Modi government.",https://www.ndtv.com/india-news/yashwant-sinha-says-constitutional-institutions-decimated-under-pm-narendra-modi-2000404
"The Supreme Court Wednesday sought response from the centre on a plea challenging the Citizenship (Amendment) Bill, which seeks to provide Indian citizenship to non-Muslims from Bangladesh, Pakistan and Afghanistan.",https://www.ndtv.com/india-news/supreme-court-seeks-centres-reply-on-plea-against-amended-citizenship-bill-2000402
"India-Pak Tension: The government has demanded the ""immediate and safe return"" of an Indian Air Force pilot captured by Pakistan after an air combat that marked the worst escalation between the neighbours in decades.",https://www.ndtv.com/india-news/india-pak-situation-live-updates-india-demands-immediate-return-of-air-force-pilot-in-pak-custody-2000399
The Supreme Court Wednesday agreed to hear the Centre's plea seeking withholding of its February 13 order asking 21 states to evict nearly 11.8 lakh forest dwellers whose claims over the land have been rejected by the authorities.,https://www.ndtv.com/india-news/centre-asks-supreme-court-to-modify-order-on-eviction-of-tribals-from-forest-land-2000396
"Author Fatima Bhutto, the grand daughter of former Pakistan Prime Minister Zulfiqar Ali Bhutto, Wednesday asked the Imran Khan government to release an Indian Air Force pilot captured after an air combat.",https://www.ndtv.com/india-news/fatima-bhutto-seeks-release-of-indian-air-force-pilot-captured-by-pak-2000391
"The US today called on India and Pakistan to ""cease all cross-border military activity"" and ""take immediate steps to deescalate the situation, including through direct communication"", a day after the first air combat between the countries in decades and the capture of an Indian pilot by Pakistan.",https://www.ndtv.com/india-news/pakistan-must-deny-terrorists-safe-haven-block-access-to-funds-us-2000390
"Acting US Defence Secretary Patrick Shanahan is focused on de-escalating tensions between India and Pakistan and has urged them both to avoid further military action, the Pentagon said on Wednesday, without saying if he had spoken with his counterparts from either nation.",https://www.ndtv.com/india-news/focused-on-de-escalating-india-pak-tensions-acting-us-defence-secretary-2000378
"Amid escalating tensions between India and Pakistan, Congress president Rahul Gandhi has cancelled a meeting of the Congress Working Committee (CWC) and the 'Jan Sankalp rally' which was to be held here on Thursday.",https://www.ndtv.com/india-news/congress-meeting-in-gujarat-postponed-over-india-pakistan-tension-2000369
"The Delhi High Court is likely to pronounce on Thursday its verdict on TTV Dhinakaran and VK Sasikala's pleas challenging the Election Commission's (EC) decision recognising the group led by Tamil Nadu Chief Minister EK Palaniswami as the real AIADMK party and allotting it the ""two leaves"" symbol.",https://www.ndtv.com/india-news/delhi-high-court-verdict-on-aiadmk-name-symbol-likely-today-2000368
"Former Prime Minister Manmohan Singh today voiced the hope that saner counsel would prevail on the Indian and Pakistani governments, and the two get back to the vital task of developing their respective countries. His statement came a day after India launched a cross-border air strike on terror camps in Pakistan on Tuesday, drawing near-instant retaliation from the neighbouring country.",https://www.ndtv.com/india-news/manmohan-singh-amid-india-pakistan-tensions-hope-saner-counsel-prevails-2000367
"Several airlines waived cancellations and re-booking charges for the armed forces and for other passengers following the escalation in tension along the Line of Control and border with Pakistan, which led the government to suspend commercial operations at most of the airports north of New Delhi Wednesday.",https://www.ndtv.com/india-news/amid-india-pak-tensions-airlines-offer-relief-to-passengers-2000364
"The Delhi High Court Wednesday sought response of the Election Commission on a plea seeking de-registration of the Nationalist Democratic Progressive Party (NDPP), which leads the alliance government in Nagaland.",https://www.ndtv.com/india-news/high-court-seeks-election-commission-reply-to-de-register-ruling-party-of-nagaland-2000362
"An Indian engineer is cycling all the way from Chennai to Germany's Hamburg, an 8500km distance to raise funds for victims of trafficking.",https://www.ndtv.com/india-news/this-indian-is-cycling-from-chennai-to-germany-to-help-trafficked-victims-2000361
The Supreme Court on Wednesday directed CBI Director Rishi Kumar Shukla to file an affidavit giving details about the alleged contempt committed by West Bengal police and the then Kolkata police chief Rajeev Kumar in connection with Saradha chit fund scam cases.,https://www.ndtv.com/india-news/west-bengal-file-affidavit-on-contempt-by-bengal-cops-in-saradha-scam-cbi-told-2000360
"The CBI has registered a case of fraud in UCO bank, wherein loans worth over <span class=""rupee"">R<span>s.</span></span> 21 crore were allegedly granted by a bank official in collusion with private persons on the basis of fake documents, officials said Wednesday.",https://www.ndtv.com/india-news/cbi-files-rs-21-86-crore-loan-fraud-case-in-uco-bank-2000359
There's a wrinkle in plans made by Asia's richest man to take on Amazon.com Inc and Walmart Inc on his home turf in India: his telecom and retail businesses can't share data.,https://www.ndtv.com/india-news/mukesh-ambani-faces-data-snag-as-he-preps-for-amazon-fight-2000355
Vedanta group firm Sterlite on Wednesday moved the Madras High Court seeking a direction to allow the reopening of its copper smelter unit at Tuticorin in Tamil Nadu which was closed last year over pollution concerns.,https://www.ndtv.com/india-news/vedanta-moves-high-court-for-reopening-sterlite-plant-in-tamil-nadu-2000354
"The Jaish-e-Mohammed terrorists, who were trained in the Balakot camp in Pakistan that was bombed by Indian fighter jets, used to take four major infiltration routes to enter Jammu and Kashmir to carry out attacks, officials said on Wednesday.",https://www.ndtv.com/india-news/balakot-trained-jaish-e-mohammed-terrorists-used-to-take-4-routes-through-pakistan-occupied-kashmir-2000352
"Pakistan resorted to firing and heavy mortar shelling on forward posts along the Line of Control in Jammu and Kashmir's Poonch district today, violating the ceasefire agreement for the sixth consecutive day.",https://www.ndtv.com/india-news/pakistan-violates-ceasefire-for-6th-consecutive-day-fires-mortar-shells-2000345
"Justifying the legislature's decision to provide death penalty for repeat offence of rape, the Union government on Wednesday told the Bombay High Court that rape laws had been amended in 2013 to introduce a powerful deterrent against such crimes.",https://www.ndtv.com/india-news/rape-a-very-serious-offence-centre-defends-death-penalty-2000344
"The strategic Jammu-Srinagar National Highway was opened for stranded vehicles on Wednesday, three days after it was closed due to multiple landslides and sinking of its 25-metre portion following snowfall and rains, officials said.",https://www.ndtv.com/india-news/jammu-srinagar-national-highway-opens-after-three-days-2000336
"Several countries across the globe have called for restraint in the light of escalating tension between India and Pakistan since Tuesday morning, when Air Force fighter jets crossed its neighbour's border to strike at a terror camp in Balakot.",https://www.ndtv.com/india-news/practice-restraint-the-appeal-to-india-pakistan-from-around-the-world-2000333
"Union Home Minister Rajnath Singh on Wednesday said the Indian Air Force (IAF) air strike on terror camps in Pakistan was carried out with caution and no civilian was hurt in it, but the neighbouring country wants to defame India nevertheless.",https://www.ndtv.com/india-news/pakistan-trying-to-defame-india-after-air-force-air-strikes-rajnath-singh-2000328
"Union Minister Prakash Javadekar and his cabinet colleague Arun Jaitley on Wednesday said the opposition statement, hitting at the government and Prime Minister Narendra Modi, would play into Pakistan's hands. The opposition issued the statement in the afternoon after leaders of 21 parties met in Parliament to discuss the current escalation of hostilities with Pakistan.",https://www.ndtv.com/india-news/prakash-javadekar-says-opposition-joint-statement-good-news-for-pakistan-2000324
"Dozens of flights were cancelled or delayed over north India on Wednesday because of airspace closures and a high alert after the first aerial encounter between the Indian Air Force and Pakistani fighter jets over the Line of Control in nearly half a century. In Delhi alone, as many as 47 flights were cancelled while 16 flights were cancelled in Mumbai.",https://www.ndtv.com/india-news/iaf-indian-air-force-dozens-of-flights-disrupted-amid-border-tension-air-canada-stops-service-2000321
"A Delhi court on Wednesday sought a detailed report from the Tihar Jail authorities on a plea by Christian Michel, the alleged middleman arrested in the <span class=""rupee"">R<span>s.</span></span> 3,600-crore AgustaWestland chopper deal, claiming he has been kept in solitary confinement in the prison.",https://www.ndtv.com/india-news/in-vvip-chopper-case-court-seeks-report-on-christian-michels-solitary-confinement-2000313
"Army personnel have been deployed at sensitive locations in the city along with the local police in view of the increased tension on the Line of Control, an official said on Wednesday.",https://www.ndtv.com/india-news/mumbai-maharashtra-army-personnel-guarding-vital-installations-in-mumbai-report-2000306
"Railway Minister Piyush Goyal Wednesday announced a new railway zone for Andhra Pradesh, days after a delegation of BJP MPs from the state met the minister demanding the same.",https://www.ndtv.com/india-news/railway-minister-piyush-goyal-announces-new-railway-zone-for-andhra-pradesh-2000304
"The MiG-21 Bison fighter jet of the Indian Air Force that shot down an advanced American-origin F-16 of the Pakistani Air Force today was a highly upgraded version of the Vietnam-era Soviet jet. A common thing between the two fighter jets is that both have been continuously upgraded and have seen extensive combat use by nations that purchased them from the US and the USSR, later Russia. In today's air battle, India also lost a Mig-21 Bison. ""...The Pakistani aircraft was seen by ground forces falling from the sky on the Pakistan side. In this engagement, we have unfortunately lost one MiG 21. The pilot is missing in action. Pakistan has claimed that he is in their custody. We are ascertaining the facts,"" Foreign Ministry spokesperson Raveesh Kumar told reporters today.",https://www.ndtv.com/india-news/how-indias-legacy-fighter-jet-downed-pakistan-f-16-10-things-to-know-about-mig-21-bison-2000291
"Hours after Pakistan said that it captured two Indian Air Force pilots today, its military went back on the claim to clarify that it has ""only one"" in custody. Major General Asif Ghafoor tweeted a photograph of the pilot who was shot down earlier in the day, along with a caption that read: ""There is only one pilot under Pakistan Army's custody.""",https://www.ndtv.com/india-news/after-saying-2-iaf-pilots-captured-pakistan-corrects-claim-to-only-one-2000290
"Nearly two weeks after the Pulwama suicide bombing that killed 40 CRPF soldiers, the centre stepped up efforts to block the source of terror funding in Jammu and Kashmir. In a massive crackdown today, income tax officers raided four places in Kashmir valley and three in Delhi belonging to the ""head of a prominent organisation and his associates"" who have been allegedly carrying out ""anti-national"" activities, the government said today.",https://www.ndtv.com/india-news/hard-disks-found-in-terror-funding-raids-in-delhi-jammu-and-kashmir-tax-officials-2000285
"The Border Security Force along with its brave soldiers and all the officers are as always alert, says official.",https://www.ndtv.com/india-news/border-areas-of-rajasthan-on-high-alert-amid-tension-between-india-pakistan-2000284
"Russia on Wednesday urged India and Pakistan to ''show restraint"" as it expressed ""serious concern"" about the escalation of hostilities between the two countries.",https://www.ndtv.com/india-news/russia-says-show-restraint-amid-escalating-india-pak-tensions-2000281
Samajwadi Party president Akhilesh Yadav on Wednesday said the nation stands with him and is praying for his safe return.,https://www.ndtv.com/india-news/akhilesh-yadav-to-indian-air-force-pilot-in-pakistans-custody-nation-stands-with-you-2000279
A red alert has been sounded by the Delhi Metro Rail Corporation amid tensions between India and Pakistan.,https://www.ndtv.com/india-news/delhi-metro-on-red-alert-amid-tension-between-india-and-pakistan-2000275
"India confirmed that an injured Air Force Pilot is in Pakistan's custody and said it expected his ""immediate and safe return"" after both countries engaged in an air battle.",https://www.ndtv.com/india-news/india-wants-safe-return-of-air-force-pilot-in-pak-custody-full-statement-2000264
Prime Minister Narendra Modi met with the chiefs of the three armed forces at his residence in New Delhi Wednesday after an Indian Air Force fighter jet went down during an aerial encounter over the Line of Control in the morning and the pilot was captured by Pakistan.,https://www.ndtv.com/india-news/pm-modi-meets-service-chiefs-after-pakistan-captures-indian-air-force-pilot-2000257
Britain's junior Foreign Office minister Mark Field said he will speak with Indian and Pakistani envoys on Wednesday to urge their countries to exercise restraint after both sides said they shot down each other's fighter jets.,https://www.ndtv.com/india-news/britain-asks-india-pak-to-exercise-restraint-after-air-skirmish-2000252
"An aid of <span class=""rupee"">R<span>s.</span></span> 1,507 crore has been credited into bank accounts of 42 lakh drought-affected farmers, Maharashtra Finance Minister Sudhir Mungantiwar said on Wednesday. He said <span class=""rupee"">R<span>s.</span></span> 2,909 crore have been allocated for this purpose.",https://www.ndtv.com/india-news/1-507-crore-paid-to-maharashtra-farmers-in-drought-hit-areas-sudhir-mungantiwar-2000240
"In a special mission in March, the Indian space agency will launch an electronic intelligence satellite Emisat for the DRDO, 28 third party satellites and also demonstrate its new technologies like three different orbits with a new variant of Polar Satellite Launch Vehicle (PSLV) rocket, said a top official.",https://www.ndtv.com/india-news/isro-to-launch-defence-satellite-in-march-for-drdo-2000235
"21 opposition parties have issued a joint statement, condemning the Pulwama terror attack and lauding the courage of Indian Air Force pilots who destroyed a Jaish-e-Mohammed training camp in Pakistan.",https://www.ndtv.com/india-news/iaf-strikes-in-pakistan-21-parties-allege-politicization-of-sacrifices-full-statement-2000225
Prime Minister Narendra Modi posted on Instagram a video of his brief interlude on the Delhi Metro with a toddler on his way to an event in the capital. PM Modi took the Metro ride on a packed day that began with a top-level security meeting following India's air strike targeting a major terror training camp within Pakistan.,https://www.ndtv.com/india-news/pm-narendra-modi-shares-video-with-his-adorable-young-friend-watch-here-2000215
"In view of escalating tensions with India, Pakistan has closed its airspace for commercial flights and indefinitely suspended flight operations at many of its major airports. According to news agency PTI, Pakistan's Civil Aviation Authority announced this after its military's media arm - the Inter-Services Public Relations - acknowledged the development.",https://www.ndtv.com/india-news/pakistan-closes-airspace-suspends-flights-amid-escalating-tensions-2000211
"A combined team of the Indian Navy and National Disaster Response Force (NDRF) on Wednesday pulled out a second body from the 370 feet deep flooded coal mine in Meghalaya's East Jaintia Hills district where 13 miners still remain trapped since December 13, 2018, an official said.",https://www.ndtv.com/india-news/second-body-pulled-out-of-meghalaya-coal-mine-5-bodies-detected-till-now-2000210
"A day after Indian fighter jets bombed the biggest terror camp of the Jaish-e-Mohammed or JeM in Pakistan's Balakot, the Shiv Sena on Wednesday demanded continuous operations, dubbing the Pakistan ""dangerous"" for the entire world.",https://www.ndtv.com/india-news/world-peace-possible-only-after-pak-eliminated-from-global-map-shiv-sena-2000190
"Senior leaders of 21 opposition parties who met in parliament today said they backed the armed forces and expressed deep concern for the Air Force pilot who went missing during this morning's engagement with Pakistani Air Force.  But there was sharp criticism for the ""leaders of the ruling party"" for politicization of the ""sacrifices of the armed forces"" - a veiled reference to Prime Minister Narendra modi who had sharply criticized the Congress at a government function last evening.",https://www.ndtv.com/india-news/stand-with-nation-army-says-opposition-after-mega-meet-in-parliament-2000188
