intro,links
"As Pakistan claimed it had an Indian pilot in custody following an aerial encounter with the Indian Air Force over the Line of Control in Jammu and Kashmir today, there were calls to treat him humanely and in accordance to the Geneva Conventions.",https://www.ndtv.com/india-news/indian-air-force-pilot-geneva-convention-as-pak-claims-indian-pilot-in-custody-calls-to-follow-genev-2000185
An Emirates flight from Dubai to Delhi was diverted on Wednesday after Pakistan's airspace was closed amid escalating tensions between India and Pakistan.,https://www.ndtv.com/india-news/emirates-flight-to-delhi-diverted-due-to-closure-of-pakistan-airspace-2000169
Prime Minister Narendra Modi on Wednesday took a dig at the opposition over the Rajya Sabha's lack of productivity and said it is a matter of concern.,https://www.ndtv.com/india-news/pm-narenedra-modi-asks-youths-to-question-rajya-sabha-lawmakers-for-poor-productivity-2000159
The Defence Acquisition Council approved the procurement of three cadet training ships for the Indian Navy.,https://www.ndtv.com/india-news/approval-granted-for-purchase-of-defence-equipment-worth-rs-2-700-crore-2000155
"In what can be seen as a diplomatic victory for New Delhi, China today supported India's stand on Pakistan-based terrorism and said that terror groups cannot be used to promote a country's political and geopolitical goals.",https://www.ndtv.com/india-news/china-backs-india-stand-on-pakistan-cant-use-terror-to-promote-a-countrys-political-and-geopolitical-2000152
"The ministry of civil aviation was ""strictly"" following the ""guidelines and instructions"" of the Indian Air Force, Minister of State for Civil Aviation Jayant Sinha said on Wednesday.",https://www.ndtv.com/india-news/jayant-sinha-says-ministry-strictly-following-indian-air-forces-2000148
"Pakistan Prime Minister Imran Khan has called for dialogue with India, hours after a Pakistani F-16 jet crossed the Line of Control and was engaged by Mig-21 Bison aircraft of the Indian Air Force.",https://www.ndtv.com/india-news/imran-khan-to-india-better-sense-should-prevail-between-both-countries-let-us-open-corridor-of-negot-2000129
India today said an Indian pilot is missing after an Indian Air Force aircraft shot down a Pakistani jet that was targeting installations in India.,https://www.ndtv.com/india-news/india-shot-down-pak-f-16-aircraft-says-government-full-statement-2000111
"The Supreme Court on Wednesday sought the Centre's response on a petition challenging two notifications related to Passport Rules and Foreigners Rules that allow religious minorities, except Muslims, facing persecution in neighbouring countries, to stay in India even if they had entered without valid documents.",https://www.ndtv.com/india-news/supreme-court-seeks-centres-reply-on-plea-challenging-changes-in-foreigners-rules-2000105
"As tensions escalate between India and Pakistan after the Pulwama terror attack and the subsequent air strike by India, Finance Minister Arun Jaitley today said India has the capability to eliminate terrorist masterminds roaming freely in the neighbouring country.",https://www.ndtv.com/india-news/us-navy-seals-killed-bin-laden-in-pakistans-abbottabad-why-cant-india-says-arun-jaitley-2000102
"An Indian pilot who was declared ""missing in action"" after an Air Force fighter jet shot down a Pakistani aircraft targeting military installations in India, is in Pakistan's custody, the government has confirmed. Pakistan had earlier on Wednesday claimed it had captured the pilot, as a video circulated by Pakistani accounts showed a man in uniform, blindfolded and wounded.",https://www.ndtv.com/india-news/air-force-pilot-missing-pakistan-claims-hes-in-their-custody-we-are-ascertaining-claims-government-2000101
A battery of senior opposition leaders are holding an emergency meeting in parliament following the escalation in hostilities with Pakistan since yesterday's airstrikes on a Jaish-e-Mohammed terror camp in Balakot.,https://www.ndtv.com/india-news/after-security-meeting-at-pms-office-opposition-meets-in-parliament-2000098
Bharatiya Janata Party ally Lok Janshakti Party chief and Union Minister Ram Vilas Paswan on Wednesday said that the country is fully safe in the hands of Prime Minister Narendra Modi as was reflected in the air strikes against the biggest training camp of the Jaish-e-Mohammed (JeM) at Balakot in Pakistan.,https://www.ndtv.com/india-news/india-is-safe-in-the-hands-of-prime-minister-narendra-modi-ram-vilas-paswan-2000092
Prime Minister Narendra Modi on Wednesday took a dig at the Opposition over the Rajya Sabha's lack of productivity and said it is a matter of concern.,https://www.ndtv.com/india-news/youth-must-ask-lawmakers-about-lack-of-rajya-sabha-productivity-pm-narendra-modi-2000061
"After seven girls from a shelter home in Patna escaped four days ago, the last of them has been found in Bihar's Madhubani today. Police had found the other six girls within 24 hours of their escape.",https://www.ndtv.com/india-news/police-find-last-of-7-girls-who-ran-away-from-shelter-home-in-bihar-2000037
"Manmohan Singh led a decent government, there was no vainglorious, stroking about thumping of 56-inch chest, said Shashi Tharoor.",https://www.ndtv.com/india-news/shashi-tharoor-takes-a-jibe-at-pm-modi-over-56-inch-chest-remark-2000022
"Prime Minister Narendra Modi is scheduled to visit Amethi, the parliamentary constituency of Congress president Rahul Gandhi, on March 3 and address a public meeting there.",https://www.ndtv.com/india-news/pm-narendra-modi-to-address-rally-in-amethi-rahul-gandhis-constituency-on-sunday-2000018
The hill resorts of Mussoorie and Nainital in Uttarakhand received yet another spell of snowfall on Wednesday.,https://www.ndtv.com/india-news/uttarakhand-weather-nainital-mussoorie-receive-fresh-snowfall-2000006
"Robert Vadra, the brother-in-law of Congress President Rahul Gandhi, on Wednesday appeared before the Enforcement Directorate (ED) for questioning for the seventh time in connection with its probe into a money laundering case.",https://www.ndtv.com/india-news/robert-vadra-appears-before-enforcement-directorate-in-money-laundering-case-1999992
"AgustaWestland accused Rajiv Saxena, who was arrested in the Rs 3,600-crore money-laundering case, today moved a Delhi court to become an approver in the case.",https://www.ndtv.com/india-news/vvip-chopper-case-agustawestland-accused-rajiv-saxena-moves-court-to-become-approver-1999983
"A man in Bihar's Patna was arrested after he posted a message on WhatsApp, threatening a blast at a rally of Prime Minister Narendra Modi on March 3, police said on Wednesday.",https://www.ndtv.com/india-news/bihar-man-arrested-for-whatsapp-threat-to-bomb-pm-narendra-modis-rally-police-1999982
Himachal Snowfall: The Shimla weather department has forecast more snowfall in high and mid hills and rain in low hills and plains of the state till February 28.,https://www.ndtv.com/india-news/schools-shut-in-himachal-pradesh-shimla-kinnaur-due-to-snowfall-1999979
"Aiming to increase the number of berths and save travel time, the Indian Railways is probing the idea of having two locomotives to haul its Rajdhani Express trains, one in front and the other at the rear, to increase their speed and save travel time, a railway ministry official said.",https://www.ndtv.com/india-news/railways-aim-at-two-locomotive-rajdhanis-to-save-time-increase-berths-1999973
"Two members of Jamaat-ul-Mujahideen Bangladesh (JMB) have been arrested from West Bengal's Murshidabad district, a senior police officer said, adding that several explosive materials were seized from them.",https://www.ndtv.com/india-news/2-jamaat-ul-mujahideen-members-arrested-in-west-bengals-murshidabad-1999966
"In an escalation of hostilities a day after Indian Air Force Jets crossed the Line of Control and struck a terror training camp, Pakistan claimed ""strikes across Line of Control from within Pakistani airspace"".",https://www.ndtv.com/india-news/pakistan-claims-strikes-across-line-of-control-from-within-pak-airspace-says-purpose-to-demonstrate-1999961
"Six Air Force officers and a civilian were killed after an Indian Air Force (IAF) chopper crashed in Jammu and Kashmir's Budgam on Wednesday morning, a senior police officer told NDTV. The crash took place in the backdrop of heavy shelling and firing from across the border on a day IAF fighter jets crossed the Line of Control and destroyed a vast terror camp within Pakistan in a pre-dawn strike on Tuesday.",https://www.ndtv.com/india-news/military-aircraft-crashes-in-jammu-and-kashmirs-budgam-two-bodies-found-says-police-report-1999950
"Residents in the earthquake-prone Balakot town in Pakistan's Khyber-Pakhtunkhwa province said on Thursday that they were woken by ""loud explosions"" and thought a fresh earthquake must have hit the region when Indian Air Force jets destroyed a large terror training camp.",https://www.ndtv.com/india-news/residents-in-paks-balakot-thought-indian-air-strikes-were-earthquake-1999948
"The order to shut down eight airports over the northern states of Jammua and Kashmir, Punjab and Himachal Pradesh has been withdrawn. Flight operations have already resumed from some airports, including Jammu.",https://www.ndtv.com/india-news/airspace-shut-over-jammu-leh-and-srinagar-say-sources-1999943
"It is telling that no country, including China, has spoken out in favour of Pakistan after India's air strike on a terror camp in the country, a former Pakistani envoy to the US said Tuesday, asserting that it was reflective that the world's patience on terrorist safe havens is running thin.",https://www.ndtv.com/india-news/iaf-balakot-air-strike-husain-haqqani-no-country-spoke-in-our-favour-on-indian-strike-1999934
"The US has asked Pakistan to take ""meaningful action"" against terrorist groups a day after India destroyed a major terror training camp across the Line of Control. The Donald Trump administration also called for India and Pakistan to ""exercise restraint"" amid heightened tension between the two countries.",https://www.ndtv.com/world-news/us-says-pak-must-act-against-terror-groups-urges-restraint-after-indias-strike-on-jaish-afp-1999868
"A day after India sent its fighter jets across the Line of Control to strike a Jaish-e-Mohammed terror camp within Pakistan, Minister of External Affairs Sushma Swaraj said in China that India wants to avoid any ""further escalation of the situation"" and will ""continue to act with responsibility and restraint"".",https://www.ndtv.com/india-news/russia-india-china-ric-meet-foreign-minister-sushma-swaraj-raises-pulwama-terror-attack-with-chinese-1999863
"Two Jaish-e-Mohammed terrorists were killed in an encounter that broke out early this morning in Jammu and Kashmir's Shopian, the police said. The encounter took place a day after Indian fighter jets struck the biggest training camp of Jaish within Pakistan.",https://www.ndtv.com/india-news/shopian-encounter-encounter-breaks-out-between-terrorists-security-forces-in-jammu-and-kashmirs-shop-1999851
"IAF Strike At Balakot, Pakistan: Pakistani claims of shooting down Indian fighter jets were denied by India, saying ""all our pilots are accounted for"" after Pakistan claimed in a statement that strikes across Line of Control are ""from within Pakistani airspace.""",https://www.ndtv.com/india-news/indian-air-force-iaf-balakot-strike-updates-border-tension-day-after-iaf-strike-at-balakot-pakistan-1999849
All government and private schools located within 5 kilometres of the Line of Control (LoC) in Jammu and Kashmir's Rajouri district will remain closed todayas Pakistani troops fired mortar shells at several areas hours after the Indian Air Force bombed a Jaish-e-Mohammed camp in Pakistan's Balakot.,https://www.ndtv.com/india-news/amid-pakistan-shelling-schools-near-line-of-control-in-rajouri-closed-today-1999844
"Expressing dismay over violence that broke out in Arunachal Pradesh over granting permanent residence to six non-Arunachal Pradesh Scheduled Tribe (APSTs) communities, Home Minister Kumar Waii on Tuesday denied reports that three people were killed in police firing during the protests.",https://www.ndtv.com/india-news/no-deaths-in-police-firing-during-protests-says-arunachal-home-minister-1999837
"Lok Sabha Speaker Sumitra Mahajan on Tuesday praised the Air Force for the strike on a terror camp in Pakistan and equated the operation to the tale of Lord Hanuman returning safely after setting Lanka ablaze, as mentioned in the Ramayana.",https://www.ndtv.com/india-news/air-force-showed-bravery-like-lord-hanuman-sumitra-mahajan-1999828
"Hours after Indian Air Force fighter planes struck a terror camp in Balakot across the Pakistan border, External Affairs Minister Sushma Swaraj left for China to attend a Russia-India-China meeting on Tuesday night. She is also expected to hold bilateral meetings on the pre-dawn air strike with foreign ministers of the two countries.",https://www.ndtv.com/india-news/sushma-swaraj-leaves-for-trilateral-meet-in-china-amid-india-pakistan-tension-1999827
The Ministry of Civil Aviation is organising a conclave today on the theme -- ''flying for all'' -- where more than 200 delegates including industry leaders and regulators will deliberate on issues and opportunities in the sector.,https://www.ndtv.com/india-news/civil-aviation-ministrys-flying-for-all-conclave-today-in-delhi-1999826
"UN chief Antonio Guterres is following the situation between India and Pakistan ""very closely"" and has appealed to the governments of both nations to exercise ""maximum restraint"" to ensure the situation does not deteriorate further, a top UN official said Tuesday.",https://www.ndtv.com/india-news/un-chief-asks-india-pak-to-use-maximum-restraint-after-air-strike-on-jaish-1999823
"A toddler was mauled to death by a leopard in Sarasiya range of Gir forest in Amreli district, an official said on Tuesday.",https://www.ndtv.com/india-news/leopard-kills-infant-in-gujarat-1999822
"Haryana Chief Minister Manohar Lal Khattar on Tuesday announced the ""Mukhyamantri Parivar Samman Nidhi"" scheme for farmers of the state cultivating up to five acres of land and families having income less than <span class=""rupee"">R<span>s.</span></span> 15,000 per month.",https://www.ndtv.com/india-news/haryana-announces-scheme-for-families-with-income-below-rs-15-000-a-month-1999819
"The National Investigation Agency on Tuesday carried out searches at seven locations, including on the houses of separatists like Mirwaiz Umer Farooq, in connection with a case related to funding to terrorist and separatist groups in Jammu and Kashmir, officials said.",https://www.ndtv.com/india-news/nia-raids-houses-of-separatists-including-mirwaiz-farooq-in-kashmir-1999815
"Not satisfied with the responses of ED, a Delhi court has asked the probe agency's three senior officials to apprise it in person of the details of ongoing investigation in an over <span class=""rupee"">R<span>s.</span></span> 6 crore money laundering case against former Haryana chief minister OP Chautala.",https://www.ndtv.com/india-news/probe-agencys-response-sought-in-money-laundering-case-against-op-chautala-1999814
